{
  "$schema": "./schemas/toolchain-lock.schema.json",
  "manifestVersion": 1,
  "state": "locked",
  "supportedTargets": ["win32-x64", "linux-x64", "darwin-x64", "darwin-arm64"],
  "tools": {
    "mangabind": {
      "sourceRepo": "https://github.com/gustavommcv/mangabind",
      "pin": {
        "releaseTag": "v0.6.1",
        "protocolVersion": "1",
        "checksums": {
          "assetName": "checksums.txt",
          "url": "https://github.com/gustavommcv/mangabind/releases/download/v0.6.1/checksums.txt",
          "sha256": "7c53b96f52df1f404ef1aa288c0a8d3ca7b5e70b657a2f77083f42c56be556f4"
        },
        "artifacts": {
          "win32-x64": {
            "assetName": "mangabind_windows_amd64.zip",
            "url": "https://github.com/gustavommcv/mangabind/releases/download/v0.6.1/mangabind_windows_amd64.zip",
            "archiveSha256": "fc4eace562043feddd236aa3eae90e1a48a59ac4468cc4fb6c3629a5435a9f1f",
            "executableSha256": "6e38503ba0393a4e4e06389f317c2cc34c0a69a21727b381a091d68d26872a08"
          },
          "linux-x64": {
            "assetName": "mangabind_linux_amd64.tar.gz",
            "url": "https://github.com/gustavommcv/mangabind/releases/download/v0.6.1/mangabind_linux_amd64.tar.gz",
            "archiveSha256": "af6eae9f11bbed34796de9eef937ba40bfe2a54a8d87d5490e4ae3460bcbeed3",
            "executableSha256": "a98008f32221b6c35ca5ef6ea1dc131e761a18a54534991bd537ad6796dedaa0"
          },
          "darwin-x64": {
            "assetName": "mangabind_darwin_amd64.tar.gz",
            "url": "https://github.com/gustavommcv/mangabind/releases/download/v0.6.1/mangabind_darwin_amd64.tar.gz",
            "archiveSha256": "30b76fb7cdc4ea7d2ac7761c2a4b9d7c09714660cdad7fd7feb2ef656cd7c0ae",
            "executableSha256": "e9c9455f050686abdd6a6864949e9849dbad31eb79304802204477a5e40bd1e1"
          },
          "darwin-arm64": {
            "assetName": "mangabind_darwin_arm64.tar.gz",
            "url": "https://github.com/gustavommcv/mangabind/releases/download/v0.6.1/mangabind_darwin_arm64.tar.gz",
            "archiveSha256": "9db0e338c9713060b8b33a01a48319d459881b0acc0d3caf0c80fa11c7c0e025",
            "executableSha256": "d224a22550cb8027681128738a590f98bb1a8a5ff0b21e126d0819d0f9f33875"
          }
        }
      }
    },
    "mangapress": {
      "sourceRepo": "https://github.com/gustavommcv/mangapress",
      "pin": {
        "releaseTag": "v0.7.2",
        "protocolVersion": "1",
        "checksums": {
          "assetName": "checksums.txt",
          "url": "https://github.com/gustavommcv/mangapress/releases/download/v0.7.2/checksums.txt",
          "sha256": "9306bfd7eb553a25e4a91ab9d652650a1ae2df25460f8ded67a568550ee66e11"
        },
        "artifacts": {
          "win32-x64": {
            "assetName": "mangapress-x86_64-pc-windows-msvc.zip",
            "url": "https://github.com/gustavommcv/mangapress/releases/download/v0.7.2/mangapress-x86_64-pc-windows-msvc.zip",
            "archiveSha256": "169cf84de11357dfe45869be27a24fd731fe39f52932ed0e192b7e17d1791ec4",
            "executableSha256": "27198c042f6dc55a0252cbeb051ceccf437de6bac63124e316849bbd7fa2b3dd"
          },
          "linux-x64": {
            "assetName": "mangapress-x86_64-unknown-linux-musl.tar.gz",
            "url": "https://github.com/gustavommcv/mangapress/releases/download/v0.7.2/mangapress-x86_64-unknown-linux-musl.tar.gz",
            "archiveSha256": "cd8f23590a6140eadb03ba6d3550e89b9d7c021edb8005f53b941076f8ddd035",
            "executableSha256": "dad69cd6176b3e943bf33d21b4a10094b240afad649cc3786b775f56e95d84b0"
          },
          "darwin-x64": {
            "assetName": "mangapress-x86_64-apple-darwin.tar.gz",
            "url": "https://github.com/gustavommcv/mangapress/releases/download/v0.7.2/mangapress-x86_64-apple-darwin.tar.gz",
            "archiveSha256": "aee05aa7f5a87cfcca1850d2eae89cdba8966921fb1c5fcb5ac00b5801a083a5",
            "executableSha256": "5468edb0e3cdc2f1dd0e1fd3a1f9c37b6e05efa1aafb91b9cb12c4b846b04eb8"
          },
          "darwin-arm64": {
            "assetName": "mangapress-aarch64-apple-darwin.tar.gz",
            "url": "https://github.com/gustavommcv/mangapress/releases/download/v0.7.2/mangapress-aarch64-apple-darwin.tar.gz",
            "archiveSha256": "8806b7180838dd5f90466b20ce4d1650be154331a58a939dfe3bb164c9fe0023",
            "executableSha256": "e92e7daa22d0340369c9785bc578fc9f7813d9b6197f9609b9a513a7d94dc7fd"
          }
        }
      }
    }
  }
}
